Unnamed: 0,Author,Year,Title,Grau,Course,Pages,Institution,City,Link,Resumo,Autor,Orientador,Palavras,Area,Linha,Projeto,Financiador,PDF_Name
18,"Carreiro, Alex Kevyn Dos Anjos",2022,Ensino De Computação Quântica Na Nuvem,Mestrado Profissional, Ensino De Física  - Profis,89,Universidade Federal Do Norte Do Tocantins,São Paulo,https://sucupira.capes.gov.br/sucupira/public/consultas/coleta/trabalhoConclusao/viewTrabalhoConclusao.jsf?popup=true&id_trabalho=13655660,"neste trabalho, apresentamos inicialmente uma breve introdução ao formalismo matemático utilizado na mecânica quântica. em seguida, introduzimos alguns conceitos de computação quântica, como sistemas de bits quânticos e portas lógicas quânticas. apresentamos, também, um circuito quântico que gera a superposição de dois estados. com relação à parte de ensino, utilizamos o referencial teórico da teoria da aprendizagem, proposta por david ausubel, que tem como foco principal a estrutura cognitiva do discente. aplicamos um produto educacional intitulado “ensino da computação quântica por meio da plataforma ibm-qe e o gato toddy: acordado ou dormindo?” com o objetivo de ensinar física e computação quântica para os discentes do ensino médio. a metodologia da aplicação do produto educacional incluiu uma pesquisa qualitativa e quantitativa, na qual, realizamos a coleta dos dados por meio de dois questionários, o primeiro com o objetivo de identificar os conhecimentos prévios dos discentes, e o segundo com o propósito de analisar o desenvolvimento intelectual dos educandos. para a realização experimental do produto educacional, que contém a resolução da parte analítica do princípio de superposição e sua correspondente codificação na plataforma ibm quantum experience, utilizamos uma metodologia de sequência didática intitulada “engenharia didática”, desenvolvida por michele artigue, que é composta por quatro fases, análise prévia, análise a priori, experimentação e análise a posteriori. a pesquisa foi realizada em um colégio estadual localizado em araguaína-to. o perfil dos participantes foi alunos das séries dos primeiros e segundos anos do ensino médio. por meio da análise qualitativa da aplicação do produto, obser- vamos como principal resultado uma aprendizagem significativa, pois os discentes se mostraram aptos a resolver problemas complexos de física e computação moderna. portanto, nosso produto educacional mostrou-se eficaz como objeto gerador de conhecimento aos discentes do ensino médio, que conseguiram compreender significativamente a utilização da física quântica e da computação quântica.",Alex Kevyn Dos Anjos Carreiro,Matheus Pereira Lobo,"['Ensino De Física Quântica', 'Computação Quântica', 'Engenharia Didática', 'Aprendizagem Significativa.']",Ensino De Física,['Física No Ensino Médio'],,,18-dissertação_Alex_(com_assinaturas).pdf
19,"Pozzobom, Mauro Buemo",2021,Estudo Experimental De Recursos Quânticos Usando Os Computadores Quânticos Da Ibm,Doutorado, Física,143,Universidade Federal De Santa Maria,Santa Maria,https://sucupira.capes.gov.br/sucupira/public/consultas/coleta/trabalhoConclusao/viewTrabalhoConclusao.jsf?popup=true&id_trabalho=11081159,"estados bell-diagonais são de extrema importância para a compreensão da dinâmica e das aplicações de alguns recursos quânticos. propriedades quânticas como steering, emaranhamento e coerência, dentre outras, podem ser usados como recursos em computação quântica. devido a isso, julgamos necessário o entendimento sobre a preparação desses estados. nós criamos um circuito quântico ajustável, que implementamos no computador quântico da international business machines (ibm). esses computadores são uma excelente possibilidade para realizar experimentos como este. implementamos o circuito em três diferentes chips quânticos que estão disponíveis na plataforma on-line. como exemplo, medimos a não localidade, steering, emaranhamento, discórdia e coerência não local para estados de werner, que são um tipo especial dos estados bell-diagonal. comparamos os resultados teóricos com os dados experimentais. notamos o efeito prejudicial que o ruído pode provocar nos circuito quânticos, trazendo efeitos indesejáveis de decoerência para o sistema. modelamos de maneira simples o ruído através de dois canais quânticos amplitude damping e phase damping. tentamos verificar a relação direta entre medidas de discórdia e emaranhamento, assim como observar experimentalmente a mudança súbita para a discórdia. mesmo realizando estes testes em diversos chips quânticos, não foi possível fazer tal verificação com grande clareza. por outro lado, é conhecida a grande importância do princípio da complementaridade de bohr para a mecânica quântica. no entanto, a busca por quantificadores para medir característica de onda ou de partícula, em um sistema quântico, sempre foi muito grande. recentemente um formalismo foi desenvolvido a partir de propriedades básicas da matriz densidade (ρ ≥ 0, trρ = 1). utilizamos o computador quântico da ibm para verificar as relações de complementaridade baseadas nestas propriedades. calculamos coerência quântica, previsibilidade e correlações quânticas para uma classe particular de estados quânticos de um qubit e também para estados quânticos aleatórios de um, dois e três qubits. notamos que para ambos os casos, a interação do sistema com ambiente, e a consequente criação de correlação, gera diminuição na soma da coerência quântica e previsibilidade mas que é compensada pelo aumento das correlações quânticas entre sistema e ambiente.",Mauro Buemo Pozzobom,Jonas Maziero,"['Estados Bell-Diagonal', 'Estados De Werner', 'Computador Quântico', 'Recursos Quânticos', 'Relações De Complementaridade.']",Fisica,['Matéria Condensada Teórica'],"Propriedades Quânticas Como Recursos, E Suas Aplicações",Fund Coord De Aperfeicoamento De Pessoal De Nivel Sup - Programa De Demanda Social,19-PhD_Mauro.pdf
20,"Alcantara, Maigan Stefanne Da Silva",2021,Categorias Relacionais Para Computação Quântica,Doutorado, Ciências Da Computação,128,Universidade Federal De Pernambuco,Recife,https://sucupira.capes.gov.br/sucupira/public/consultas/coleta/trabalhoConclusao/viewTrabalhoConclusao.jsf?popup=true&id_trabalho=11203998,"propomos um estudo sistemático das categorias relacionais como modelos da computação quântica através da abordagem categórica de coecke-abramsky. as categorias relacionais são aquelas que os objetos ou os morfismos são relações. esses modelos são importantes para o desenvolvimento da ciência da computação quântica porque nos fornecem uma linguagem abstrata para descrever processos quânticos. isso nos dá um alto nível de compreensão de como a teoria quântica funciona e o que podemos fazer com ela. além disso, é interessante explorar modelos que generalizem a teoria quântica e a relacionem com outras teorias. as categorias compacta dagger foram aplicadas com sucesso nos fundamentos da mecânica quântica em geral. investigamos as propriedades categóricas dos espaços de chu como um modelo para a mecânica quântica categórica e, especificamente, como modelos para a computação quântica. definimos duas categorias com base nos espaços de chu, churel e relchu, e provamos que elas são modelos categóricos robustos para computação quântica. mais precisamente, mostramos que a categoria churel é uma categoria compacta dagger e possui duas estruturas de base complementares, semelhantes à conhecida categoria de conjuntos e relações finitos, frel, utilizada na literatura. mostra-se também que a categoria dos espaços de chu é uma categoria regular, portanto é possível obter a categoria relchu, por meio da construção geral de heunen e tull, e explorar suas propriedades quânticas. além disso, essa tese revisa quatro categorias de relações l-fuzzy, cada uma modelando áreas onde a teoria dos conjuntos fuzzy pode ser aplicada. uma relação l-fuzzy é uma relação valorada em um reticulado completo l com uma estrutura monoidal. revisamos as noções dessas relações binárias multi-valoradas e apresentamos algumas propriedades básicas das categorias correspondentes visando aplicações em áreas como ciência da computação, lógica linear e mecânica quântica. a ênfase está nos aspectos monoidais das categorias. as categorias monoidais são um dos tipos de categorias mais aplicadas, uma vez que todas as categorias com uso em física, topologia, computação e lógica, são monoidais. uma visão monoidal das relações fuzzy pode ampliar o espectro de aplicações da teoria dos conjuntos fuzzy.",Maigan Stefanne Da Silva Alcantara,Silvio De Barros Melo,"['Teoria Das Categorias', 'Mecânica Quântica Categórica', 'Computação Quântica', 'Espaços De Chu', 'Conjuntos Fuzzy', 'Relações Fuzzy.']",Teoria Da Computação,['Matemática Computacional'],,,Download Failed
21,"Pimenta, Raphael Cesar De Souza",2022,Estudo Da Viabilidade Do Uso Da Computação Quântica Para Análise De Propriedades De Sólidos Periódicos,Mestrado, Física - Ufsj - Unifal,93,Universidade Federal De Alfenas,Alfenas,https://sucupira.capes.gov.br/sucupira/public/consultas/coleta/trabalhoConclusao/viewTrabalhoConclusao.jsf?popup=true&id_trabalho=11362345,"a física de materiais tem sido desenvolvida ao longo das últimas décadas com grande ajuda de simulações digitais nos supercomputadores que temos disponíveis no século atual. porém, é certo que há conhecidos limites de até onde podem chegar essas simulações e quais sistemas somos capazes de simular em um tempo de computação eficaz. a computação quântica surge com promessas de romper certas barreiras da computação clássica, aumentando a capacidade computacional disponível para as mais diversas tarefas e, possivelmente, uma delas será a física de materiais. em nosso trabalho realizamos uma revisão bibliográfica do que é feito atualmente para simulação de materiais periódicos através da computação quântica, assim como também realizamos algumas simulações em computadores quânticos disponíveis para acesso público. um grande ponto de nosso levantamento foi que, dentre todas as aplicações da computação quântica, a aplicação em física de sólidos periódicos ainda é modesta, sendo a aplicação em sistemas moleculares uma das maiores fontes de trabalhos e referências. pudemos realizar com o que descobrimos, simulações para a estrutura de bandas de alguns átomos, como o silício e o grafeno em um simulador local. também pudemos simular em uma máquina quântica in silico um modelo generalizado de hamiltoniano para estudar o seu comportamento a medida que variávamos seus parâmetros. para o grafeno, fomos capazes de calcular sua estrutura em um simulador quântico local e o resultado foi similar ao que era esperado pela literatura. para o silício obtivemos uma diferença acentuada no seu estado de energia excitado, que acreditamos ser devido a simplicidade de nossa aproximação.",Raphael Cesar De Souza Pimenta,Anibal Thiago Bezerra,"['Computação Quântica', 'Algoritmos Quânticos', 'Computação Quântica Aplicada A Materiais.']",Física Da Matéria Condensada,"['Simulação E Modelagem Computacional De Moléculas', ' Fluidos E Sólidos']",Estudo De Primeiros Princípios (Dft) De Ligas Metálicas,Fund Coord De Aperfeicoamento De Pessoal De Nivel Sup - Programa De Demanda Social,21-Diss_raphaelpimenta_(1).pdf
22,"Silva, Joao Marcos Costa Da",2023,Transposição Didática Da Computação Quântica: Estados Emaranhados E Teleporte Quântico,Mestrado Profissional, Ensino De Física  - Profis,90,Universidade Federal Do Norte Do Tocantins,São Paulo,https://sucupira.capes.gov.br/sucupira/public/consultas/coleta/trabalhoConclusao/viewTrabalhoConclusao.jsf?popup=true&id_trabalho=13637453,"neste trabalho, desenvolvemos um white paper para auxiliar os estudantes a conhecer e manipular informações quânticas com a utilização de ferramentas matemáticas no contexto do ensino médio. apresentamos uma análise do ensino de física moderna e contemporânea (fmc) no brasil e sua ausência no currículo proposto para o ensino médio. discutimos sobre a teoria da computação quântica, em específico sobre portas lógicas e circuitos quânticos, com seu devido aparato matemático e conceitual. abordamos estes conceitos empregando três metodologias ativas, são elas aprender fazendo, sequência de ensino e aprendizagem e aprendizagem baseada em problema. assim, unimos o conteúdo de física moderna e contemporânea com as metodologias ativas e construímos um produto educacional que foi utilizado com estudantes do ensino médio. também discutimos sobre a aplicação do produto educacional com a proposta pedagógica sugerida, de modo a almejar a aprendizagem significativa por parte dos alunos. por fim, após a aplicação do produto educacional e da análise dos resultados obtidos, constatamos, por meio das resoluções desenvolvidas pelos alunos, que eles demonstraram interesse e habilidades (matemáticas e conceituais) necessárias para a compreensão dos conteúdos de fmc, fator que contribui, significativamente, para a formação científica dos estudantes.",Joao Marcos Costa Da Silva,Matheus Pereira Lobo,"['Computação Quântica', 'Circuito Quântico', 'Teleporte Quântico', 'Metodologias Ativas.']",Ensino De Física,['Física No Ensino Médio'],,,22-Dissertação_João_Marcos.pdf
23,"Alvarez, Pedro Henrique Pereira De Carvalho",2023,Simulação De Magnetorecepção Aviária Em Computadores Quânticos,Mestrado, Física,68,Universidade Estadual De Campinas,Campinas,https://sucupira.capes.gov.br/sucupira/public/consultas/coleta/trabalhoConclusao/viewTrabalhoConclusao.jsf?popup=true&id_trabalho=13857302,"neste trabalho, é proposta uma técnica de simulação de reações químicas dependentes de spin em computadores quânticos, capaz de reproduzir resultados teóricos já estabelecidos na literatura. o estudo começa com uma revisão das evidências experimentais e comportamentais da magnetorecepção aviária, ativada por luz de aves migratórias de pequeno porte, seguida de uma explicação da reação de par-radical que permite essa magnetorecepção e dos principais modelos teóricos da literatura. finalmente, é demonstrado como nosso sistema de simulação em circuitos quânticos reproduz resultados de simulações numéricas dos modelos teóricos estabelecidos. esses resultados mostram o potencial da computação quântica para simular reações químicas complexas e apontam para possibilidades futuras de pesquisa na área.",Pedro Henrique Pereira De Carvalho Alvarez,Marcos Cesar De Oliveira,"['Simulação Quântica', 'Biologia Quântica', 'Magnetorecepção']",Física,['Informação Quântica'],,Fund Coord De Aperfeicoamento De Pessoal De Nivel Sup - Programa De Excelência Acadêmica,23-Pedro_Alvarez.pdf
24,"Rosa, Evandro Chagas Ribeiro Da",2021,Ket Quantum Programming,Mestrado, Ciências Da Computação,109,Universidade Federal De Santa Catarina,Florianópolis,https://sucupira.capes.gov.br/sucupira/public/consultas/coleta/trabalhoConclusao/viewTrabalhoConclusao.jsf?popup=true&id_trabalho=11501398,"as linguagens de programação quântica preenchem a lacuna entre a mecânica quântica e as construções clássicas de programação para simplificar o desenvolvimento de aplicações quânticas. no entanto, a maioria das linguagens de programação quântica abordam apenas as restrições intrínsecas à programação quântica sem observar as restrições advindas da construção dos computadores quânticos. devido à decoerência, computadores quânticos em nuvem devem executar o mais rápido possível, possibilitando apenas o processamento em lote que limita a interação entre computadores clássicos e quânticos. neste trabalho, apresentamos o ket, uma linguagem de programação quântica embarcada em python para programação híbrida clássica-quântica que mitiga essa limitação de interação com uma arquitetura de tempo de execução adequada para computadores quânticos em nuvem. como componente central da arquitetura de tempo de execução proposta, apresentamos a biblioteca c++ libket, que introduz geração de código de tempo de execução para possibilitar a programação quântica genérica com execução dinâmica, enquanto mantém a computação quântica o mais específica possível. o libket também introduz as variáveis do tipo future para atrasar a execução quântica. estas variáveis, por sua vez, são utilizadas pelo ket para mitigar a limitação de interação entre computadores clássico e quântico. ket, libket e o ket bitwise simulator (kbw) compõem o framework de programação quântica ket. com o kbw, melhoramos a representação bitwise, tornando o tempo de simulação não dependente do número de qubits, mas sim da quantidade de superposição e emaranhamento do sistema.",Evandro Chagas Ribeiro Da Rosa,Rafael De Santiago,"['Computação Quântica', 'Programação Quântica', 'Simulação Quântica']",Ciência Da Computação,['Inteligência Computacional'],,,Download Failed
25,"Diniz, Ciro Micheletti",2022,Dos Conceitos Fundamentais Da Termodinâmica Ao Resetting De Computadores Quânticos ﻿,Mestrado, Física,74,Universidade Federal De São Carlos,São Carlos,https://sucupira.capes.gov.br/sucupira/public/consultas/coleta/trabalhoConclusao/viewTrabalhoConclusao.jsf?popup=true&id_trabalho=11580504,"enquanto a área da termodinâmico é há séculos conhecida e estudada, a área da computação, mais especificamente da computação quântica, é recente e são muitas as pesquisas feitas atualmente para se compreender e desenvolver tal área. apesar da diferença de idade e de conceitos que esses ramos da física têm, os dois são entendidos e expressos por funções e princípios fundamentais, tais como energia, entropia, informação, calor, conceitos de dissipação e conservação, entre muitos outros. com o avanço e desenvolvimento das áreas o entendimento que temos sobre tais assuntos está sempre se atualizando. somente no último século, por exemplo, passamos a relacionar entropia com informação no escopo da computação. também neste último século que foi desenvolvido por r. landauer um princípio que relacionava, também na área da computação, informação com calor, este que sempre foi fortemente ligado a área da termodinâmica. assim, foi possível notar que haviam intersecções entre as as áreas da computação e da termodinâmica. com o passar do tempo, surgiu a computação quântica, que apesar de nova, é uma área que está crescendo rapidamente, principalmente devido ao seu apelo tecnológico. neste trabalho, estamos focados na ligação que estes ramos possuem, e assim como o princípio de landauer, focamos nossos estudos em funções que conectam as duas áreas, usando definições apropriadas para sistemas quânticos, a fim de aumentar a compreensão que temos sobre a termodinâmica quântica. através das análises dos resultados obtidos, fomos capazes de observar comportamentos novos e alguns até contraintuitivos sobre as dinâmicas das funções que foram estudas. um desses comportamentos nos proporcionou desenvolver um protocolo de reinicialização de sistemas quânticos, ferramenta esta que é muito utilizada na computação.",Ciro Micheletti Diniz,Celso Jorge Villas Boas,"['Mecânica Quântica', 'Termodinâmica', '', 'Cadeias De Qubits']",Física,['Física Atômica E Molecular'],Efeitos Coletivos Em Ensembles Atômicos/Cadeias De Spins E Processamento De Informação Quântica,Cons Nac De Desenvolvimento Cientifico E Tecnologico - Bolsa De Mestrado No País Gm,25-Dissertação_Ciro.pdf
26,"Cruz, Igor Martins Grechi",2023,Passeios Aleatórios Quânticos,Mestrado, Modelagem De Sistemas Complexos,77,Universidade De São Paulo,São Paulo,https://sucupira.capes.gov.br/sucupira/public/consultas/coleta/trabalhoConclusao/viewTrabalhoConclusao.jsf?popup=true&id_trabalho=14396777,"a computação quântica é uma área de pesquisa relativamente nova em que cientistas e empresas de todo o mundo estão investigando suas potenciais aplicações, tanto no contexto cientifico quanto no contexto industrial. em particular, a implementação de algoritmos quânticos e a arquitetura de qubits são as tarefas principais para a execução das aplicações de interesse. apesar das grandes vantagens que computadores quânticos podem proporcionar em relação aos computadores clássicos, existem grandes desafios a serem superados como a decoerência e os ruídos que interferem nos processos investigativos e nos resultados das rotinas empregadas. o trabalho investiga o passeio quântico unidimensional e sua implementação nos computadores quânticos da ibm. comparamos os principais resultados do passeio clássico com o passeio quântico, em especial foi investigado que o passeio quântico não apresenta uma distribuição de probabilidade normal a medida que o número de passos aumenta, resultado que é observado para o passeio clássico. além disso, o desvio padrão do passeio quântico é proporcional ao número de passos $n$, enquanto o desvio padrão do passeio clássico é dado por $\sqrt{n}$. através dos computadores quânticos da ibm foram realizados simulações, primeiramente de um passeio quântico de dois qubits e outra de um passeio quântico de três qubits. os resultados para a simulação do passeio quântico de dois qubits indicam que a simulação efetuada em um computador quântico real obteve um bom desempenho apesar dos fatores de interferência e decoerência não serem desprezíveis. no entanto, os resultados para o passeio quântico de três qubits apresentaram muito ruído.",Igor Martins Grechi Cruz,Jose Ricardo Goncalves De Mendonca,"['Computação Quântica', 'Passeio Quântico', 'Algoritmos Quânticos']",Sistemas Complexos,['Fundamentos De Sistemas Complexos'],Maiores Subsequências Crescentes De Passeios Aleatórios E Séries Temporais Correlacionadas,,Download Failed
27,"Arenstein, Lucas Silva",2022,"Uma Introdução À Computação Quântica, Protocolos De Complexidade De Comunicação Quânticos, Não-Localidade E Parâmetros Quânticos De Grafos.",Mestrado, Ciência Da Computação,107,Universidade De São Paulo,São Paulo,https://sucupira.capes.gov.br/sucupira/public/consultas/coleta/trabalhoConclusao/viewTrabalhoConclusao.jsf?popup=true&id_trabalho=12386597,"quais são as vantagens que a computação quântica pode oferecer em relação à computação clássica? o objetivo desta tese é responder a esta pergunta sob diferentes perspectivas, com este intuito, dividimos este trabalho em três partes. na primeira parte começamos a estudar os princípios básicos da computação quântica. em seguida aprenstamos dois algoritmos quânticos; o algoritmo de deutsch-jozsa e o algoritmo de grover. o primeiro possui uma menor complexidade de query, já o segundo possui uma menor complexidade de tempo quando comparados aos melhores algoritmos clássicos para os mesmos problemas. o último tópico é uma explicação detalhada com um exemplo de como utilizar o algoritmo de grover para resolver uma fórmula booleana expressa na forma normal conjuntiva. na segunda parte abordamos problemas de complexidade de comunicação. estes problemas normalmente envolvem duas pessoas, alice e bob, que em locais separados recebem um input de um juiz. o objetivo deles é calcular o valor de uma função que depende dos seus inputs com a menor quantidade de comunicação entre eles. nesta parte, apresentamos protocolos nos quais a transmissão de bits quânticos (qubits), ao invés de bits, podem reduzir a quantidade de comunicação necessária para resolver estes tipos de problemas. também estudamos como alice e bob podem utilizar o emaranhamento quântico para resolver dois problemas de complexidade de comunicação sem que haja comunicação entre ambos, algo que não pode ser feito classicamente. na parte iii estudamos jogos não-locais inspirados em parâmetros usuais da teoria dos grafos. jogos não-locais são definidos como jogos em que jogadores que podem compartilhar e operar em um estado emaranhado possuem algum tipo de vantagem sobre jogadores clássicos. iniciamos esta última parte apresentando o número cromático quântico de um grafo. esta quantidade representa o menor número de cores necessárias para alice e bob convencerem um juiz que possuem uma coloração própria de um grafo ao jogarem um jogo não-local. terminamos esta tese apresentando outros dois parâmetros quânticos de grafos, um relacionado ao homomorfismo de grafos e o outro ao número de independência de um grafo.",Lucas Silva Arenstein,Yoshiharu Kohayakawa,"['Computação Quântica', 'Algoritmos Quânticos', 'Algoritmo De Grover', 'Complexidade De Comunicação Quântica', 'Não-Localidade', 'Parâmetros Quânticos De Grafos', 'Número Cromático Quântico']",Ciência Da Computação,['Combinatória E Teoria Dos Grafos'],,Cons Nac De Desenvolvimento Cientifico E Tecnologico - Bolsa De Mestrado No País Gm,Download Failed
