Unnamed: 0,Author,Year,Title,Grau,Course,Pages,Institution,City,Link,Resumo,Autor,Orientador,Palavras,Area,Linha,Projeto,Financiador,PDF_Name
42,"Prado, Marcelo Velludo De Souza",2023,Tomografia De Hamiltoniano Para Sistemas De Dois Qubits,Mestrado, Ciência Da Computação,68,Universidade Estadual Paulista Júlio De Mesquita Filho ( São José Do Rio Preto ),São Paulo,https://sucupira.capes.gov.br/sucupira/public/consultas/coleta/trabalhoConclusao/viewTrabalhoConclusao.jsf?popup=true&id_trabalho=14178881,"para sistemas quânticos fechados, a energia é uma observável que pode ser representada por uma matriz hermitiana chamada de hamiltoniano. com a hamiltoniano que descreve o sistema quântico, podemos determinar a sua dinâmica através da equação de schrödinger, que diz a taxa de variação de um estado |ψ(t)⟩ com respeito a um determinado instante t. resolvendo a equação para um estado inicial consegue-se determinar a evolução do sistema. utilizando o hamiltoniano que descreve um sistema de duplos pontos quânticos, e medindo as observáveis locais, aplicamos o modelo de aprendizado de máquina extra-trees com o objetivo de realizar a tomografia completa do hamiltoniano. ficou demonstrado a efetividade da solução em diversas situações e, afim de obter diretrizes para auxiliar o físico experimental, realizamos analises exploratórias com o intuito de melhorar o entendimento sobre o problema de tomografia de hamiltoniano.",Marcelo Velludo De Souza Prado,Felipe Fernandes Fanchini,"['Informação Quântica', 'Tomografia De Hamiltoniano', 'Aprendizado De Máquinas', 'Regressão']",Computação Aplicada,['Sistemas De Computação'],Controle Quântico Em Sistemas Dissipativos,,Download Failed
43,"Avila, Anderson Braga De",2020,Hybrid-Gm: Parallel Model For Quantum Computing Targeted To Hybrid Architectures,Doutorado, Computação,96,Universidade Federal De Pelotas,Pelotas,https://sucupira.capes.gov.br/sucupira/public/consultas/coleta/trabalhoConclusao/viewTrabalhoConclusao.jsf?popup=true&id_trabalho=9275421,"avila, anderson braga de. hybrid-gm: parallel model for quantum computing targeted to hybrid architectures. orientador: renata hax sander reiser. 2020. 96 f. tese (doutorado em computation) – centro de desenvolvimento tecnológico, universidade federal de pelotas, pelotas, 2020. uma grande quantidade de pesquisas científicas e desenvolvimentos tecnológicos ainda depende de simulações de computação quântica, uma vez que os computadores quânticos ainda são limitados por implementações físicas. atualmente, o desenvolvimento de algoritmos de computação quântica tem sido realizado por procedimentos analíticos ou de simulação enquanto os computadores quânticos não estão amplamente disponíveis. embora a simulação de computação quântica seja paralela por natureza, a complexidade espacial e temporal são os maiores riscos de desempenho, pois os estados quânticos e as transformações quânticas aumentam exponencialmente com o número de qubits simulados. esta proposta contribui desde a concepção até a consolidação do modelo hybrid-gm, bem como introduz a extensão do ambiente d-gm, proporcionando execuções paralelas eficientes para computação quântica, que neste trabalho é voltada para arquiteturas híbridas, considerando tanto cpu quanto gpu. o modelo hybrid-gm explora as potencialidades da computação de alto desempenho, fornecendo funcionalidades e explorando operadores de projeção que atuam em estruturas quânticas, estados e transformações, para manipular a granularidade e distribuição de cálculos. neste contexto, a distribuição das computações é baseada em estruturas de dados em árvore, onde os nós intermediários e finais correspondentes às camadas de projeção e execução são configurados para otimizar os recursos de hardware. simulações dos algoritmos de shor e grover foram realizadas a fim de avaliar o modelo hybrid-gm, e os resultados alcançaram melhorias de desempenho significativas para execuções em cpu e gpu. quando comparados com a versão anterior do d-gm, eles apresentaram speedups de 21× e 9, 5× para simulações paralelas em cpu e de 61, 9× e 38, 32× para simulações em gpu. além disso, em relação aos simuladores liqui|i e projectq, a simulação paralela com 23 qubits do shor foi 4, 64× mais rápida e do grover foi 32× mais rápida. os resultados das simulações híbridas mostraram que é possível aumentar o desempenho para algumas classes de algoritmos, melhorando o desempenho do algoritmo de grover em até 3, 18× em comparação ao uso apenas da abordagem gpu.",Anderson Braga De Avila,Renata Hax Sander Reiser,"['Keyword-One', 'Keyword-Two', 'Keyword-Three', 'Keyword-Four.']",Ciência Da Computação,['Fundamentos Da Computação'],,,43-TESE_Anderson.pdf
44,"Avalos, Claver Francisco Palomino",2020,Simulação Quântica Da Eletrodinâmica Quântica Com Espinores,Mestrado, Física,124,Universidade Federal De Santa Catarina,Florianópolis,https://sucupira.capes.gov.br/sucupira/public/consultas/coleta/trabalhoConclusao/viewTrabalhoConclusao.jsf?popup=true&id_trabalho=9317014,"atualmente, a computação clássica é uma ferramenta útil que permite simular e descrever muitos fenômenos da física. no entanto, os computadores clássicos não são eficientes na simulação de fenômenos quânticos. foi em 1982, quando r. feynman propôs usar um computador quântico capaz de imitar a dinâmica de um sistema quântico que não pode ser implementado em laboratório ou analisado com os computadores clássicos atuais. a simulação quântica é um processo pelo qual um sistema é criado para imitar outro. levando em consideração a proposta de feynman, propõe-se um protocolo de simulação quântica das interações que ocorrem na eletrodinâmica quântica no gauge de coulomb, considerando graus de liberdade internos como o spin do elétron e polarização do fóton. o mapeamento de férmions para qubits é realizado usando a transformação de jordan-wigner. este protocolo mostra um desafio para a simulação quântica da qed, devido aos 64 termos de interação descrito pelo hamiltoniano de interação. a implementação de um sistema análogo ou digital desse protocolo poder ser útil em alguns fenômenos descritos na teoria quântica de campo e química quântica onde a auto-interação de elétrons ou interação elétron-pósitron é estudada considerando o spin.",Claver Francisco Palomino Avalos,Bruno Gouvea Taketani,"['Simulação Quântica', 'Eletrodinâmica Quântica', 'Jordan-Wigner', 'Computação Quântica', 'Teoria Quântica De Campos', 'Feynman.']",Física Atômica E Molecular,['Óptica Quântica E Informação Quântica'],,Fund Coord De Aperfeicoamento De Pessoal De Nivel Sup - Programa De Demanda Social,44-disertacao_claver_P_Avalos_assinado.pdf
45,"Filho, Fernando Tenorio De Miranda",2020,Projeto Evolutivo De Circuitos Combinacionais Quânticos,Mestrado, Engenharia Elétrica E Computação,45,Universidade Presbiteriana Mackenzie,São Paulo,https://sucupira.capes.gov.br/sucupira/public/consultas/coleta/trabalhoConclusao/viewTrabalhoConclusao.jsf?popup=true&id_trabalho=9914409,"enquanto os avanços em hardware quântico ocorrem em passos modestos, simuladores rodando em computadores clássicos permitem um avanço um pouco mais rápido na construção de algoritmos quânticos. dada uma matriz unitária que efetue determinada operação, obter o circuito quântico equivalente é uma tarefa não trivial que pode ser modelada como um problema de busca. uma abordagem genérica que torne possível a síntese automática destes circuitos permitiria não são o estudo e desenvolvimento de novos algoritmos, mas também avaliar o custo-benefício relacionado ao tamanho e complexidade do circuito. um problema comum encontrado em trabalhos anteriores é o uso de portas quânticas controladas de unitárias gerais, em razão da dificuldade de implementação física de tais portas. neste trabalho apenas portas controladas do tipo cnot são utilizadas, resultando em circuitos mais próximos da realidade física. um algoritmo evolutivo é proposto para decompor uma matriz unitária em uma sequência equivalente de portas quânticas. o método é testado para encontrar decomposições das unitárias de toóli, da transformada quântica de fourier de dois qubits e da moeda para o caminhante quântico. os resultados mostram que o algoritmo é eciente em encontrar as soluções, e que o problema da convergência prematura é evitado ao se utilizar populações que evoluem em paralelo.",Fernando Tenorio De Miranda Filho,Pedro Paulo Balbi De Oliveira,"['Computação Quântica', 'Circuitos Quânticos', 'Matriz Unitária', 'Algoritmos Evolutivos']",Engenharia De Computação,['Computação E Sistemas Adaptativos'],Computation And Dynamics Of Deterministic Automata Networks - Codanet (Funded By Capes Stic-Amsud 88881.197456/2018-01),Fund Coord De Aperfeicoamento De Pessoal De Nivel Sup - Programa De Suporte À Pós-Graduação De Instituições De Ensino Particulares (Módulo Taxas),45-FERNANDO_TENÓRIO_DE_MIRANDA_FILHO.pdf
46,"Fernandes, Gabriel Pedro Lima Moyses",2023,Algoritmo Quântico Para O Problema De Gerenciamento De Estoque,Mestrado, Física,92,Universidade Federal De São Carlos,São Carlos,https://sucupira.capes.gov.br/sucupira/public/consultas/coleta/trabalhoConclusao/viewTrabalhoConclusao.jsf?popup=true&id_trabalho=13904722,"neste projeto de pesquisa, desenvolvemos um algoritmo quântico em computação quântica adiabática para o problema de gerenciamento de estoque, adaptado para fábricas que utilizam prateleiras gravitacionais como sistema padrão de armazenamento. o objetivo central da tarefa é determinar a alocação ideal para os itens do estoque nas prateleiras do depósito, minimizando os custos operacionais associados à logística de entrada e saída de itens e respeitando as restrições envolvidas. para isso, baseados no padrão de ocorrência dos itens nas demandas da fábrica, elaboramos uma estratégia em duas fases que busca determinar qual a forma mais eficiente de distribuir os itens entre as prateleiras e construímos um conjunto de hamiltonianos problemas que permitem implementar a estratégia no modelo de computação quântica adiabática. por fim, implementamos o algoritmo para um conjunto de instâncias simples nos computadores quânticos da d-wave, uma empresa canadense que é líder no desenvolvimento de dispositivos apropriados para implementação de computação quântica adiabática e utilizam para isso uma heurística conhecida como quantum annealing.",Gabriel Pedro Lima Moyses Fernandes,Celso Jorge Villas Boas,"['Algoritmo Quântico', 'Problema Do Gerenciamento De Estoque', 'Compu- Tação Quântica Adiabática', 'Quantum Annealing']",Física,['Física Da Matéria Condensada'],Dinâmica De Gases De Bose Ultra-Frios Induzida Por Modulações Nos Parâmetros Do Sistema,Fund Coord De Aperfeicoamento De Pessoal De Nivel Sup - Programa De Demanda Social,46-Dissertação_-_Algoritmo_Quântico_para_o_Problema_de_Gerenciamento_de_Estoque_(1).pdf
47,"Araujo, Ismael Cesar Da Silva",2023,Adaptive Ansatz Based On Low-Rank State Preparation,Mestrado, Ciências Da Computação,53,Universidade Federal De Pernambuco,Recife,https://sucupira.capes.gov.br/sucupira/public/consultas/coleta/trabalhoConclusao/viewTrabalhoConclusao.jsf?popup=true&id_trabalho=13769135,"algoritmos de preparação do estado quântico consistem em definir de uma sequência de operações unitárias para carregar um estado-alvo específico em um computador quântico. podemos utilizar estes algoritmos em aplicações como aprendizagem de máquina quântica. no entanto, alguns algoritmos para inicialização de estados quânticos têm uma complexidade de circuito exponencial com o número de qubits no sistema. é o caso dos algoritmos de codificação nas amplitudes, que é um tipo de codificação para carregar dados normalizados nas amplitudes de probabilidade do estado. para contornar esta sobrecarga na complexidade, trabalhos exploram propriedades específicas dos estados quânticos para otimizar a complexidade do circuito, como a esparsidade ou a simetria. outros trabalhos exploram a simplificação do circuito quântico para carregar um estado aproximado. é o caso das redes generativas adversariais quânticas, que utilizam uma arquitetura de circuito específica composta por blocos alternados de rotações de um qubit e portas controladas de emaranhamento de dois qubits. porém, quando treinadas para carregar distribuições aleatórias, observamos que o desempenho se deteriora à medida que o número de qubits aumenta segundo a entropia relativa. neste trabalho, propomos uma arquitetura diferente para os modelos generativos quânticos, baseada no algoritmo de preparação de estados conhecido como low-rank. e através de experimentos para carregar a distribuição log-normal, mostramos redução no erro da inicialização dos estados quânticos.",Ismael Cesar Da Silva Araujo,Adenilton Jose Da Silva,"['Computação Quântica', 'Apredizagem De Máquina Quântica', 'Circuitos Quânticos Variacionais', 'Redes Generativas Adversariais Quânticas']",Computação Inteligente,['Inteligência Artificial Simbólica'],,,Download Failed
48,"Baptista, Pedro Vinicius Ferreira",2021,Pretty Good State Transfer,Mestrado, Ciências Da Computação,undefined,Universidade Federal De Minas Gerais,Belo Horizonte,https://sucupira.capes.gov.br/sucupira/public/consultas/coleta/trabalhoConclusao/viewTrabalhoConclusao.jsf?popup=true&id_trabalho=11322957,"passeios quânticos em tempo contínuo é uma das áreas de pesquisa em teoria algébrica de grafos e computação quântica. uma das suas sub-áreas de pesquisa é a de transferência de estados entre vértices de um grafo. transferências de estados são importantes, pois permitem avaliar em quais casos uma rede com comunicação feita através de estados modelados por um grafo permitem que esses estados sejam transmitidos com o máximo possível de probabilidade de maneira eficiente. em geral, trabalhos sobre transferência de estados lidam com transferências perfeitas ou quase perfeitas entre dois vértices. transferências perfeitas de estado possuem caracterizações para as matrizes de adjacência e laplaciana. além disso, foi mostrado ser possível verificar transferências perfeitas de estado em um grafo com um algoritmo polinomial. em relação a transferências quase perfeitas, embora existam caracterizações para sua ocorrência, tais caracterizações demandam um certo trabalho para sua verificação em grafos e nenhum algoritmo exato é conhecido para validar sua existência. alguns artigos mostram que, devido às restrições que as transferências perfeitas impõem nos autoespaços do grafo, tais transferências são relativamente raras em classes comuns de grafos. portanto, é natural tentar verificar a ocorrência de transferências quase perfeitas de estados. nessa dissertação, apresenta-se o primeiro algoritmo exato para conferir a ocorrência de transferências quase perfeita de estados em grafos. além disso, aplicou-se resultados conhecidos nas matrizes de adjacência e laplaciana de transferências perfeita e quase perfeita de estados na matriz normalizada laplaciana, considerando sua relação com passeios clássicos em grafos.",Pedro Vinicius Ferreira Baptista,Gabriel De Morais Coutinho,"['Teoria Algébrica De Grafos', 'Passeios Quânticos', 'Transferências De Estado', 'Computação Quântica']",Ciencia Da Computacao,[''],,,48-PedroViniciusFerreiraBaptista.pdf
49,"Vieira, Luciano Alves",2022,Processos De Construção E De Decodificação De Códigos Quânticos Tóricos,Mestrado, Engenharia Elétrica,116,Universidade Estadual De Campinas,Campinas,https://sucupira.capes.gov.br/sucupira/public/consultas/coleta/trabalhoConclusao/viewTrabalhoConclusao.jsf?popup=true&id_trabalho=11966078,"neste trabalho, apresentamos um estudo sobre construção e decodificação do código tórico, primeiro código quântico topológico proposto. inicialmente, compilamos os conceitos preliminares necessários à compreensão do tema. para a apresentação do código tórico, estudamos sua estrutura e identificamos seus parâmetros por meio de duas abordagens, a primeira fundamentada principalmente na teoria de homologia e co-homologia, e a segunda visando entender o comportamento dos anyons dentro do sistema. por fim, o problema da decodificação é introduzido para dois modelos de erros: um que considera a síndrome fidedigna e outro que prevê a existência de erros nas medições dos geradores do código. analisamos as particularidades que surgem na decodificação com cada um dos casos. ao longo do trabalho, buscamos utilizar exemplos que reforcem os conceitos apresentados.",Luciano Alves Vieira,Reginaldo Palazzo Junior,"['Código Tórico', 'Computação Quântica', 'Códigos Corretores De Erros Quânticos', 'Códigos Quânticos Topológicos.']",Telecomunicacoes E Telematica,"['Teoria Da Informação', ' Codificação E Criptografia (Ag)']",,Cons Nac De Desenvolvimento Cientifico E Tecnologico - Bolsa De Mestrado No País Gm,49-arquivo_Luciano_Alves_Vieira.pdf
50,"Teles, Laurita Istefani Da Silva",2021,Localização  Em Caminhadas Quânticas Com Um Único Defeito De Rede,Mestrado, Física,50,Universidade Do Estado De Santa Catarina,Joinville,https://sucupira.capes.gov.br/sucupira/public/consultas/coleta/trabalhoConclusao/viewTrabalhoConclusao.jsf?popup=true&id_trabalho=10860241,"neste trabalho, estudamos como um único defeito de rede em uma caminhada quântica de tempo discreto afeta a probabilidade de retorno de uma partícula quântica. o defeito é modelado por uma moeda quântica na posição de origem do caminhante que é distinta das demais moedas sobre a rede. essa moeda tem uma dependência explícita com um parâmetro �� que quantifica a intensidade da localização. investigamos dois diferentes tipos de defeitos para os quais mostramos como a localização pode ter uma dependência apenas com �� (n. konno, quantum inf. process. 9, 405, 2010) e também, com os ângulos polar �� e azimutal �� do qubit inicial (a. wójcik et al, phys. rev. a 85, 012329, 2012) por meio de cálculos numéricos. além disso, propomos um novo defeito de rede, cuja localização possui uma dependência adicional em �� + �� levando a perfis extras de localização. comparamos as caminhadas quânticas com nosso defeito de rede às anteriores da literatura e discutimos suas propriedades de propagação e probabilidade de sobrevivência.",Laurita Istefani Da Silva Teles,Edgard Pacheco Moreira Amorim,"['Caminhadas Quânticas', 'Localização', 'Defeito De Rede', 'Probabilidade De Sobrevivência']",Física,['Informação E Computação Quântica'],Informação E Computação Quântica: Aplicações Da Caminhada Aleatória Quântica,Fund Coord De Aperfeicoamento De Pessoal De Nivel Sup - Programa De Demanda Social,50-Dissertação_-_Laurita.pdf
51,"Engster, Joao Pedro",2021,Transferência De Estados Em Grafos Via Caminhadas Quânticas Contínuas No Tempo,Mestrado, Física,58,Universidade Do Estado De Santa Catarina,Joinville,https://sucupira.capes.gov.br/sucupira/public/consultas/coleta/trabalhoConclusao/viewTrabalhoConclusao.jsf?popup=true&id_trabalho=11136121,"quando um estado quântico se espalha por uma rede de posições discretas, em certas circunstâncias é possível que este se recomponha em outra região da rede, fenômeno chamado de transferência de estado. neste trabalho, investigamos a transferência de estado a partir de caminhadas quânticas contínuas no tempo em grafos circulares cn. descobrimos que estados iniciais dados por uma superposição de estados de posição que obedece uma distribuição estatística,cuja dispersão inicial é suficientemente grande, possuem transferência de estado e periodicidade com alta fidelidade, mesmo em grafos grandes (n ⩾ 100). a fidelidade melhora à medida que o estado inicial se aproxima de uma distribuição gaussiana. identificamos os principais aspectos da geometria da distribuição do estado inicial que otimizam a transferência de estado e encontramos uma expressão analítica para calcular a densidade de probabilidade de um estado gaussiano ao longo do tempo para diferentes tamanhos do grafo cn.",Joao Pedro Engster,Edgard Pacheco Moreira Amorim,"[': Caminhadas Quânticas', 'Grafos', 'Estados Deslocalizados', 'Transferência De Estados']",Física,['Informação E Computação Quântica'],Informação E Computação Quântica: Aplicações Da Caminhada Aleatória Quântica,,51-Dissertação_-_João_Pedro.pdf
52,"Cerutti, Lorena Rosa",2023,Caminhadas Quânticas Desordenadas Com Barreira Absorvedora,Mestrado, Física,96,Universidade Do Estado De Santa Catarina,Joinville,https://sucupira.capes.gov.br/sucupira/public/consultas/coleta/trabalhoConclusao/viewTrabalhoConclusao.jsf?popup=true&id_trabalho=13824413,"neste trabalho estudamos o comportamento da probabilidade de escape para caminhadas quânticas unidimensionais de tempo discreto com barreira absorvedora em diferentes posições da rede via método analítico e simulações numéricas. a partir de ambas as abordagens, observamos que a probabilidade de escape depende do estado interno inicial do caminhante (qubit) e da posição da barreira absorvedora. em seguida, estudamos caminhadas quânticas desordenadas dinamicamente e estaticamente com uma barreira absorvedora, assumindo que para uma quantidade de passos de tempo muito grande, a probabilidade de escape média sobre várias caminhadas segue uma lei de potência com o tempo. nesse contexto, obtemos que quando a barreira está muito próxima do caminhante, no geral, ele é totalmente absorvido pela barreira em taxas de tempo cada vez maiores na medida que o nível de desordem da caminhada aumenta, tornando-se muito semelhante ao comportamento clássico em alguns casos. por outro lado, quando a barreira está bem afastada da origem, as taxas de absorção diminuem significativamente, ao ponto que a partícula escapa parcialmente ou totalmente da barreira absorvedora em alguns casos de desordem estática.",Lorena Rosa Cerutti,Edgard Pacheco Moreira Amorim,"['Caminhadas Quânticas', 'Localização', 'Barreira De Absorção', 'Desordem']",Física,['Informação E Computação Quântica'],Informação E Computação Quântica: Aplicações Da Caminhada Aleatória Quântica,Fundacao De Amparo A Pesquisa E Inovacao Do Estado De Santa Catariana - Edital De Chamada Pública Fapesc/Capes Nº 21/2021,52-Lorena_dissertacao.pdf
53,"Andrade, Joacir Soares De",2023,Aplicações Da Função Wq De Lambert-Tsallis E Da Disentropia Em Distribuição Quântica De Chaves,Doutorado, Engenharia De Teleinformática,undefined,Universidade Federal Do Ceará,Fortaleza,https://sucupira.capes.gov.br/sucupira/public/consultas/coleta/trabalhoConclusao/viewTrabalhoConclusao.jsf?popup=true&id_trabalho=14426140,"a presente tese versa sobre distribuição quântica de chaves e está dividida em uma parte teórica e uma parte experimental. na parte teórica, a função w<sub>q</sub> de lambert-tsallis é utilizada para encontrar a fórmula analítica do comprimento de canal que maximiza a taxa de transmissão de bits seguros em uma rede óptica com sinais clássicos e quânticos trafegando na mesma fibra, em comprimentos de onda diferentes, e considerando o espalhamento raman espontâneo. em seguida w<sub>q</sub> é utilizada para calcular a flutuação de portadores em um modulador de amplitude integrado em sio2 usado em qkd de variáveis contínuas, e no cálculo do parâmetro que modela um canal quântico estocástico de transmissividade com distribuição uniforme. por fim, um novo protocolo de distribuição quântica de chaves chamado qkd baseado em disentropia, foi proposto. este protocolo utiliza modulação de amplitude e detecta a presença de espionagem utilizando a disentropia. é o primeiro protocolo de qkd que não utiliza a taxa de erro para detectar espionagem e é também o de mais simples implementação prática. na parte experimental, são apresentados os resultados experimentais de um detector de fótons controlado remotamente por luz.",Joacir Soares De Andrade,Rubens Viana Ramos,"['Distribuição Quântica De Chaves', 'Função Wq De Lambert-Tsallis', 'Disentropia', 'Aleatoriedade']",Eletromagnetismo Aplicado,['Dispositivos E Sistemas Quânticos'],Comunicações Quânticas Em Redes Ópticas E Computadores Quânticos Fotônicos,Fund Coord De Aperfeicoamento De Pessoal De Nivel Sup - Programa De Excelência Acadêmica,53-2023_tese_jsandrade.pdf
